#CODE;ENGLISH;FRENCH;GERMAN;;SPANISH;;;;;;;;;x
EVTDESCHF23002_B;The priests drag [target_sacrificed_prisoner.GetTitledFirstName] screaming to the [Root.GetHouseOfWorship] and they keep [target_sacrificed_prisoner.GetHerHim] steady on the altar while I slice [target_sacrificed_prisoner.GetHerHim] open with a ceremonial dagger. I then rip out [target_sacrificed_prisoner.GetHerHis] heart to the cheers of the assembled crowd.;Les prêtres traînent [target_sacrificed_prisoner.GetTitledFirstName] vers la [Root.GetHouseOfWorship] et [target_sacrificed_prisoner.GetLeLa] maintiennent stable sur l'autel pendant que je [target_sacrificed_prisoner.GetLeLa] découpe en morceaux avec un poignard de cérémonie. J'arrache ensuite son cœur sous les acclamations de la foule rassemblée.;Die Priester schleifen [target_sacrificed_prisoner.Getdendie] schreienden [target_sacrificed_prisoner.GetTitledFirstName] zum [Root.GetHouseOfWorship] und halten [target_sacrificed_prisoner.Getihnsie] auf dem Altar still, während ich [target_sacrificed_prisoner.Getihnsie] mit einem zeremoniellen Dolch aufschlitze. Dann reiße ich [target_sacrificed_prisoner.GetHerHerHerHis] unter dem Jubel der versammelten Menge das Herz heraus.;;;;;;;;;;;x
EVTDESCHF23002_C;The priests drag [target_sacrificed_prisoner.GetTitledFirstName] screaming to the [the_temple.GetName], they place [target_sacrificed_prisoner.GetHerHim] on the [the_sacrificial_altar.GetName] on top of the temple, and slice [target_sacrificed_prisoner.GetHerHim] open with a ceremonial dagger. They then rip out [target_sacrificed_prisoner.GetHerHis] heart to the cheers of the assembled crowd.;Les prêtres traînent [target_sacrificed_prisoner.GetTitledFirstName] vers le [the_temple.GetName], [target_sacrificed_prisoner.GetLeLa] placent sur l'[the_sacrificial_altar.GetName] au sommet du temple, et l'ouvrent avec un poignard de cérémonie. Ils arrachent ensuite son cœur sous les acclamations de la foule rassemblée.;Die Priester schleifen [target_sacrificed_prisoner.Getdendie] schreienden [target_sacrificed_prisoner.GetTitledFirstName] zum [the_temple.GetName], legen [target_sacrificed_prisoner.Getihnsie] auf den [the_sacrificial_altar.GetName] oben auf dem Tempel und schlitzen [target_sacrificed_prisoner.Getihnsie] mit einem zeremoniellen Dolch auf. Dann reißen sie [target_sacrificed_prisoner.Getihmihr] unter dem Jubel der versammelten Menge das Herz heraus.;;;;;;;;;;;x
EVTDESCHF23002_D;The priests drag [target_sacrificed_prisoner.GetTitledFirstName] screaming to the [the_temple.GetName] and they keep [target_sacrificed_prisoner.GetHerHim] steady on the [the_sacrificial_altar.GetName] that stands there while I slice [target_sacrificed_prisoner.GetHerHim] open with a ceremonial dagger. I then rip out [target_sacrificed_prisoner.GetHerHis] heart to the cheers of the assembled crowd.;Les prêtres traînent [target_sacrificed_prisoner.GetTitledFirstName] vers le [the_temple.GetName] et [target_sacrificed_prisoner.GetLeLa] maintiennent stable sur l'[the_sacrific_altar.GetName] pendant que je [target_sacrificed_prisoner.GetLeLa] découpe avec un poignard de cérémonie. J'arrache ensuite son cœur sous les acclamations de la foule rassemblée.;Die Priester schleifen [target_sacrificed_prisoner.Getdendie] schreienden [target_sacrificed_prisoner.GetTitledFirstName] zum [the_temple.GetName] und halten [target_sacrificed_prisoner.Getihnsie] auf dem [the_sacrificial_altar.GetName] fest, während ich [target_sacrificed_prisoner.Getihnsie] mit einem zeremoniellen Dolch aufschlitze. Dann reiße ich [target_sacrificed_prisoner.Getihmihr] unter dem Jubel der versammelten Menge das Herz heraus.;;;;;;;;;;;x
quest_the_devil_worshipers_sacrifice_ruler_desc;The powerful and mighty [Root.GetMainOldGodName] take and give. While we are rewarded with powers far beyond what most kings and queens ever dream of, everything has its price. [Root.GetMainOldGodName] demands payment in blood and souls. Offer them the life of a powerful ruler.;[Root.GetMainOldGodName], avec sa puissance, prend et donne. Bien que nous soyons récompensés avec des pouvoirs qui vont au-delà de ce dont les rois et les reines ont toujours rêvé, tout a un prix. [Root.GetMainOldGodName] exige un paiement avec du sang et des âmes. Prenez la vie d'un puissant souverain, en guise d'offrande.;[Root.GetMainOldGodName] nimmt und [Root.GetMainOldGodName] gibt. Auch wenn wir Kräfte erhalten, die jenseits all dessen sind, was selbst Könige und Königinnen sich erträumen können, hat alles seinen Preis. [Root.GetMainOldGodName] verlangt, in Blut und Seelen bezahlt zu werden. Bietet [Root.Getihmihr] das Leben eines mächtigen Herrschers dar.;;[Root.GetMainOldGodName] es una divinidad poderosa capaz de dar y quitar. Sus fieles recibimos poderes que ya quisieran los monarcas más poderosos, pero todo en esta vida tiene un precio. [Root.GetMainOldGodName] exige sangre y almas. Ofrécele la vida de un gobernante fuerte.;;;;;;;;;x
quest_the_devil_worshipers_sacrifice_ruler_tooltip;To complete this mission, §Gright-click§! on the portrait of a prisoner in your dungeons who is a landed ruler and select §Y"Sacrifice to [Root.GetMainOldGodName]"§!.;Pour réussir cette mission, faites un §Gclic droit§! sur le portrait d'un de vos prisonniers qui possède des terres et sélectionnez §Y"Sacrifier à [Root.GetMainOldGodName]"§!.;Um diese Mission abzuschließen, rechtsklickt auf das Porträt eines Gefangenen in Euren Kerkern mit Rechtsanspruch auf ein Land und wählt §Y„Für [Root.GetMainOldGodName] opfern“§!.;;Para completar esta misión, haz clic con el botón secundario en el retrato de un terrateniente preso en la mazmorra y selecciona §YHonrar a [Root.GetMainOldGodName]§!.;;;;;;;;;x
quest_the_devil_worshipers_sacrifice_holy_person_desc;The powerful and mighty [Root.GetMainOldGodName] take and give. While we are rewarded with powers far beyond what most kings and queens ever dream of, everything has a price. The [Root.GetMainOldGodName] demand payment in blood and souls. Offer them someone who has pledged their life to false gods.;[Root.GetMainOldGodName] avec sa puissance, prend et donne. Bien que nous soyons récompensés avec des pouvoirs qui vont au-delà de ce dont les rois et les reines ont toujours rêvé, tout a un prix. [Root.GetMainOldGodName] exige un paiement avec du sang et des âmes. Prenez la vie de quelqu'un qui voue sa vie [Root.Get_au_HighGod], en guise d'offrande.;[Root.GetMainOldGodName] nimmt und [Root.GetMainOldGodName] gibt. Auch wenn wir Kräfte erhalten, die jenseits all dessen sind, was selbst Könige und Königinnen sich erträumen können, hat alles seinen Preis. [Root.GetMainOldGodName] verlangt, in Blut und Seelen bezahlt zu werden. Bietet [Root.Getihmihr] jemanden dar, der sein Leben [Root.Religion.GetHighGodName] verschrieben hat.;;[Root.GetMainOldGodName] es una divinidad poderosa capaz de dar y quitar. Sus fieles recibimos poderes que ya quisieran los monarcas más poderosos, pero todo en esta vida tiene un precio. [Root.GetMainOldGodName] exige sangre y almas. Ofrécele a alguien que haya consagrado su vida a [Root.Religion.GetHighGodName].;;;;;;;;;x
quest_the_devil_worshipers_sacrifice_holy_person_tooltip;To complete this mission, §Gright-click§! on the portrait of a prisoner in your dungeons who is a [Root.Religion.GetPriestTitle] or an ascetic and select §Y"Sacrifice to [Root.GetMainOldGodName]"§!.;Pour réussir cette mission, faites un clic droit sur le portrait d'un de vos prisonniers qui est [Root.Religion.GetPriestTitle] ou ascète, et sélectionnez §Y"Sacrifier à [Root.GetMainOldGodName]"§!.;Um diese Mission abzuschließen, rechtsklickt auf das Porträt eines Gefangenen in Euren Kerkern, der den Titel „[Root.Religion.GetPriestTitle]“ trägt oder ein Asket ist, und wählt §Y„Für [Root.GetMainOldGodName] opfern“§!.;;Para completar esta misión, haz clic con el botón secundario en el retrato de un asceta preso en la mazmorra y selecciona §YHonrar a [Root.GetMainOldGodName]§!.;;;;;;;;;x
quest_the_devil_worshipers_sacrifice_virgin_desc;The powerful and mighty [Root.GetMainOldGodName] take and give. While we are rewarded with powers far beyond what most kings and queens ever dream of, everything has a price. The [Root.GetMainOldGodName] demand payment in blood and souls. Offer them the life of someone who has never known love.;[Root.GetMainOldGodName], avec sa puissance, prend et donne. Bien que nous soyons récompensés avec des pouvoirs qui vont au-delà de ce dont les rois et les reines ont toujours rêvé, tout a un prix. [Root.GetMainOldGodName] exige un paiement avec du sang et des âmes. Prenez la vie de quelqu'un qui n'a jamais connu l'amour, en guise d'offrande.;[Root.GetMainOldGodName] nimmt und [Root.GetMainOldGodName] gibt. Auch wenn wir Kräfte erhalten, die jenseits all dessen sind, was selbst Könige und Königinnen sich erträumen können, hat alles seinen Preis. [Root.GetMainOldGodName] verlangt, in Blut und Seelen bezahlt zu werden. Bietet [Root.Getihmihr] das Leben von jemandem dar, der noch nie geliebt hat.;;[Root.GetMainOldGodName] es una divinidad poderosa capaz de dar y quitar. Sus fieles recibimos poderes que ya quisieran los monarcas más poderosos, pero todo en esta vida tiene un precio. [Root.GetMainOldGodName] exige sangre y almas. Ofrécele la vida de alguien que nunca haya conocido el amor.;;;;;;;;;x
quest_the_devil_worshipers_sacrifice_virgin_tooltip;To complete this mission, §Gright-click§! on the portrait of a prisoner in your dungeons who is a virgin and select §Y"Sacrifice to [Root.GetMainOldGodName]"§!. Children, chaste and ascetic characters are likely virgins.;Pour réussir cette mission, faites un §Gclic droit§! sur le portrait d'un de vos prisonniers qui est vierge (les personnages enfants, chastes et ascétiques correspondent), et sélectionnez §Y"Sacrifier à [Root.GetMainOldGodName]"§!.;Um diese Mission abzuschließen, rechtsklickt auf das Porträt eines Gefangenen in Euren Kerkern, der eine Jungfrau ist, und wählt §„YFür [Root.GetMainOldGodName] opfern§!“. Kinder sowie keusche und asketische Personen gelten als Jungfrauen.;;Para completar esta misión, haz clic con el botón secundario en el retrato de un preso virgen de la mazmorra y selecciona §YHonrar a [Root.GetMainOldGodName]§!. Los niños, los ascetas y los personajes castos suelen cumplir este requisito.;;;;;;;;;x
quest_the_devil_worshipers_sacrifice_dwarf_desc;The powerful and mighty [Root.GetMainOldGodName] take and give. While we are rewarded with powers far beyond what most kings and queens ever dream of, everything has a price. The [Root.GetMainOldGodName] demand payment in blood and souls. Offer them the life of a dwarf.;[Root.GetMainOldGodName], avec sa puissance, prend et donne. Bien que nous soyons récompensés avec des pouvoirs qui vont au-delà de ce dont les rois et les reines ont toujours rêvé, tout a un prix. [Root.GetMainOldGodName] exige un paiement avec du sang et des âmes. Prenez la vie d'un nain, en guise d'offrande.;[Root.GetMainOldGodName] nimmt und [Root.GetMainOldGodName] gibt. Auch wenn wir Kräfte erhalten, die jenseits all dessen sind, was selbst Könige und Königinnen sich erträumen können, hat alles seinen Preis. [Root.GetMainOldGodName] verlangt, in Blut und Seelen bezahlt zu werden. Bietet [Root.Getihmihr] das Leben eines Zwergs dar.;;[Root.GetMainOldGodName] es una divinidad poderosa capaz de dar y quitar. Sus fieles recibimos poderes que ya quisieran los monarcas más poderosos, pero todo en esta vida tiene un precio. [Root.GetMainOldGodName] exige sangre y almas. Ofrécele la vida de un enano.;;;;;;;;;x
quest_the_devil_worshipers_sacrifice_dwarf_tooltip;To complete this mission, §Gright-click§! on the portrait of a prisoner in your dungeons who is a dwarf and select §Y"Sacrifice to [Root.GetMainOldGodName]"§!.;Pour réussir cette mission, faites un §Gclic droit§! sur le portrait d'un de vos prisonniers qui est un nain, et sélectionnez §Y"Sacrifier à [Root.GetMainOldGodName]"§!.;Um diese Mission abzuschließen, rechtsklickt auf das Porträt eines Gefangenen in Euren Kerkern, der ein Zwerg ist, und wählt §Y„Für [Root.GetMainOldGodName] opfern“§!.;;Para completar esta misión, haz clic con el botón secundario en el retrato de un enano preso y selecciona §YHonrar a [Root.GetMainOldGodName]§!.;;;;;;;;;x
decision_abduct_desc;Attempt to abduct and imprison §Y[This.GetBestName]§! with the help of your brethren§Y[From.GetInSocietyYellow]§!.;Tentez d'enlever et d'emprisonner §Y[This.GetBestName]§! avec l'aide de vos frères§Y[From.GetInSocietyYellow]§!.;Versucht, §Y[This.GetBestName]§! mit Hilfe Eurer Brüder§Y[From.GetInSocietyYellow]§! zu entführen und einzusperren.;;;;;;;;;;;x
EVTDESC_MNM_20070;I have put the word out among my brethren[Root.GetInSociety]. When an opportunity presents itself, the brothers and sisters in [From.Capital.GetName] will attempt to snatch [From.GetTitledFirstNameNoRegnal] and bring [From.GetObjectPronoun] to me in chains...;J'ai fait passer le mot parmi mes frères[Root.GetInSociety]. Lorsqu'une occasion se présentera, les frères et sœurs de [From.Capital.GetName] tenteront de saisir [From.GetTitledFirstNameNoRegnal] et de me l'apporter enchaîné[From.Get_E]...;Ich habe das Wort unter meinen Brüdern[Root.GetInSociety] verbreitet. Wenn sich eine Gelegenheit bietet, werden die Brüder und Schwestern in [From.Capital.GetName] versuchen, [From.GetTitledFirstNameNoRegnal] zu schnappen und [From.GetObjectPronoun] in Ketten zu mir zu bringen...;;;;;;;;;;;x
EVTDESC_MNM_20103;My brethren are not having much luck in their attempts to abduct [FromFromFrom.GetTitledFirstName]. Perhaps [Root.GetSocietyWe] are not influential enough to pull it off... Should I call it off?;Mes frères n'ont pas beaucoup de chance dans leurs tentatives d'enlèvement de [FromFrom.GetTitledFirstName]. Peut-être que [Root.GetSocietyWe] ne sommes pas assez influents pour réussir... Dois-je renoncer ?;Meine Brüder haben nicht viel Glück bei ihren Versuchen, [FromFromFrom.GetTitledFirstName] zu entführen. Vielleicht sind [Root.GetSocietyWe] nicht einflussreich genug, um es zustande zu bringen... Soll ich es abblasen?;;;;;;;;;;;x
EVTDESC_MNM_20081;My fellows[Root.GetInSociety] have informed me that [FromFromFrom.GetTitledFirstNameNoRegnal] plans to travel the realm incognito for a lark, mingling with the common folk. [FromFromFrom.GetSubjectPronounCap] will only be protected by two loyal friends during this little adventure – a great opportunity to have [FromFromFrom.GetObjectPronoun] abducted, if I so wished...;Mes camarades[Root.GetInSociety] m'ont informé que [FromFromFrom.GetTitledFirstNameNoRegnal] prévoit de voyager incognito dans le royaume pour une histoire, en se mêlant aux gens. [FromFromFrom.GetSubjectPronounCap] ne sera protégé que par deux amis fidèles pendant cette petite aventure : une belle occasion de [FromFromFrom.GetLeLa] faire enlever, si je le souhaite...;Meine Kollegen[Root.GetInSociety] haben mich darüber informiert, dass [FromFromFrom.GetTitledFirstNameNoRegnal] plant, inkognito durch das Reich zu reisen, um sich unter das gemeine Volk zu mischen. [FromFromFrom.GetSheHeCap] wird während dieses kleinen Abenteuers nur von zwei treuen Freunden beschützt werden - eine großartige Gelegenheit, [FromFromFrom.ihnsie] entführen zu lassen, wenn ich es wünsche...;;;;;;;;;;;x
EVTDESC_MNM_20081_CHILD;My fellows[Root.GetInSociety] have managed to insert themselves among the servants of [FromFromFrom.GetTitledFirstNameNoRegnal] and stand ready to snatch the child at my command.;Mes camarades[Root.GetInSociety] ont réussi à se glisser parmi les serviteurs de [FromFromFrom.GetTitledFirstNameNoRegnal] et se tiennent prêts à enlever l'enfant à mon ordre.;Meine Mitstreiter[Root.GetInSociety] haben es geschafft, sich unter die Diener von [FromFromFrom.GetTitledFirstNameNoRegnal] zu mischen und stehen bereit, das Kind auf meinen Befehl hin zu entführen.;;;;;;;;;;;x
EVTDESC_MNM_20083;My competent brethren[Root.GetInSociety] managed to snatch [From.GetTitledFirstNameNoRegnal] from [From.GetPossPronoun] guards and bring [From.GetObjectPronoun] to me in a cage!;Mes frères habiles[Root.GetInSociety] ont réussi à arracher [From.GetTitledFirstNameNoRegnal] à ses gardes et à me l'apporter dans un sac !;Meinen kompetenten Brüdern[Root.GetInSociety] gelang es, [From.GetTitledFirstNameNoRegnal] [From.Getherhis]en Wachen zu entreißen und [From.Getihnsie] in einem Käfig zu mir zu bringen!;;;;;;;;;;;x
EVTDESC_MNM_20084;My incompetent brethren[Root.GetInSociety] failed to capture [From.GetTitledFirstNameNoRegnal], though apparently they slew a guard and a servant in the attempt. Even worse, it appears that [From.GetFirstName] has started to suspect my involvement in the ambush.;Mes frères incompétents[Root.GetInSociety] n'ont pas réussi à capturer [From.GetTitledFirstNameNoRegnal], bien qu'ils aient apparemment tué un garde et un serviteur lors de cette tentative. Pire encore, il semble que [From.GetFirstName] ait commencé à soupçonner mon implication dans l'embuscade.;Meinen inkompetenten Brüdern[Root.GetInSociety] gelang es nicht, [From.GetTitledFirstNameNoRegnal] zu fangen, obwohl sie anscheinend bei dem Versuch eine Wache und einen Diener erschlugen. Schlimmer noch, es scheint, dass [From.GetFirstName] begonnen hat, meine Beteiligung an dem Überfall zu vermuten.;;;;;;;;;;;x
stop_abduct_decision_desc;Call off my [Root.GetSocietyMembers] from abducting my current target.;Empêchez mes [Root.GetSocietyMembers] d'enlever ma cible actuelle.;Ruft meine [Root.GetSocietyMembers] davon zurück, mein aktuelles Ziel zu entführen.;;;;;;;;;;;x
bloodthirsty_mass_sacrifice_decision;Hold Blood Rituals;Organiser des rituels de sang;Blutrituale halten;;;;;;;;;;;x
RULE_OPTION_EXCLAVE_PURGE_LIMITED_DESC;Exclaves of Independent Rulers at peace will be removed on succession unless they are connected to the Capital area by at least one County, via a naval path or part of the character's De Jure territory.;Les enclaves de seigneurs indépendants en paix seront perdues à la succession à moins qu'elles soient reliées à la zone de la capitale par au moins un comté, par un accès naval ou une partie du territoire de jure du personnage.;Exklaven unabhängiger Herrscher werden bei Nachfolge in Friedenszeiten entfernt, wenn sie nicht durch mindestens eine Provinz oder über einen Seeweg mit der Hauptstadt verbunden oder Teil des De-Jure-Territoriums sind.;;Los exclaves de gobernantes independientes en paz serán purgados en la sucesión a menos que conecten con el área de la capital por al menos un condado, con una ruta naval o sean parte del territorio de iure del personaje.;;;;;;;;;x
RULE_OPTION_EXCLAVE_PURGE_LIMITED_NAVAL_DESC;Exclaves of Independent Rulers at peace will be removed on succession unless they are connected to the Capital area by at least one County, via a limited naval path or part of the character's De Jure territory.;Les enclaves de seigneurs indépendants en paix seront perdues à la succession à moins qu'elles soient reliées à la zone de la capitale par au moins un comté, par un accès naval limité en longueur ou une partie du territoire de jure du personnage.;Exklaven unabhängiger Herrscher werden bei Nachfolge in Friedenszeiten entfernt, wenn sie nicht durch mindestens eine Provinz oder über einen limitierten Seeweg mit der Hauptstadt verbunden oder Teil des De-Jure-Territoriums sind.;;Los exclaves de gobernantes independientes en paz serán purgados en la sucesión a menos que se conecten con el área de la capital por al menos un condado, con una ruta naval limitada o sean parte del territorio de iure del personaje.;;;;;;;;;x
RULE_MOVEMENT_LOCK_ON_DESC;When an army has moved over halfway into a County, the order will be locked and can no longer be canceled. While movement is locked you can still cancel further orders or queue up additional orders.;Lorsqu'une armée a parcouru plus de la moitié du chemin vers le comté suivant, l'ordre ne peut plus être annulé. Vous pouvez cependant annuler les déplacements supplémentaires ou les mettre en file d'attente.;Wenn eine Armee auf halben Wege zu einer Grafschaft ist, wird die Bewegung gesperrt und kann nicht abgebrochen werden. Es können nur weitere Anordnungen abgebrochen oder neue hinzugefügt werden.;;Cuando un ejército recorre la mitad de camino a un condado, la orden queda bloqueada y no se puede cancelar. Al bloquear el movimiento, todavía puedes cancelar movimientos posteriores o poner en cola órdenes adicionales.;;;;;;;;;x
RULE_SILLY_ON_DESC;Absurd events may appear during the game.;Les évènements absurdes pourraient se produire durant la partie.;Während des Spiels können absurde Ereignisse auftreten.;;Podrá haber eventos absurdos durante la partida.;;;;;;;;;x
RULE_SILLY_OFF_DESC;No absurd events may appear during the game.;Les évènements absurdes ne peuvent pas se produire durant la partie.;Während des Spiels tauchen KEINE absurden Ereignisse auf.;;No habrá eventos absurdos durante la partida.;;;;;;;;;x
EVTDESCHFA20312;During the evening, [From.GetTitledFirstName] has remarked on multiple occasions of how it is important for a new ruler to create stable diplomatic relationships with [From.GetHerHis] peers and subjects in order to ensure peace and prosperity for everyone. [From.GetHerHisCap] show of dialectics has been a revelation for all the guests.;Pendant la soirée, [From.Get_le_TitledFirstName] a fait remarquer à plusieurs occasions à quel point il est important pour un nouveau seigneur de créer des relations stables avec ses pairs et ses sujets afin d'assurer paix et prospérité à tout le monde. Sa démonstration de dialectique a été une révélation pour tous les invités.;Während des Abends hat [From.GetTitledFirstName] mehrfach angemerkt, wie wichtig es für einen neuen Herrscher ist, stabile diplomatische Beziehungen mit [From.GetHerHis]esgleichen und [From.GetHerHis]en Untertanen zu schaffen, um Frieden und Wohlstand für alle zu gewährleisten. [From.GetHerHisCap]e Kunst der Dialektik war für alle Gäste eine Offenbarung.;;A lo largo de la tarde, [From.GetTitledFirstName] ha insistido en varias ocasiones cuán importante es para un nuevo gobernante crear relaciones diplomáticas estables con sus pares y súbdito para garantizar la paz y prosperidad para todos. Este espectáculo de dialéctica ha sido una revelación para todos los invitados.;;;;;;;;;x
RULE_GRANT_INDEPENDENCE_RESTRICTED_DESC;The Grant Independence action is restricted.;L'action « Accorder l'indépendance » est restreinte.;Die Aktion „Gewährt Unabhängigkeit“ ist begrenzt.;;"La acción ""Conceder la independencia"" está restringida.";;;;;;;;;x
RULE_GRANT_INDEPENDENCE_UNRESTRICTED_DESC;The Grant Independence action is unrestricted and can be used to grant independence to anyone.;L'action « Accorder l'indépendance » peut s'utiliser sur quiconque.;Die Aktion „Gewährt Unabhängigkeit“ ist unbegrenzt und kann verwendet werden, um jeden Unabhängigkeit zu gewähren.;;"La acción ""Conceder la independencia"" es ilimitada y se puede usar para conceder la independencia a cualquiera.";;;;;;;;;x
EVTDESC_RIP_11041_10;The red powder was tantalizing in color. A servant had made the mistake of tasting it in its pure form - his tongue had swollen up badly and [FromFrom.GetTitledFirstName] had chastized him firmly for it. [FromFrom.GetTitledFirstName] poured the spice into a chalice of water and stirred it meticulously, before feeding you a spoonful.;La poudre était attrayante en raison de sa couleur rouge. Un domestique a commis l'erreur de la goûter dans sa forme pure. Sa langue a méchamment gonflé et [FromFrom.Get_le_TitledFirstName] l'a châtié pour cela. [FromFrom.Get_Le_TitledFirstName] a versé l'épice dans une coupe d'eau et l'a méticuleusement remuée, avant de vous faire avaler une cuillerée.;Das rote Pulver war von einer verlockenden Farbe. [FromFrom.GetTitledFirstName] gab das Gewürz in einen Kelch mit Wasser und rührte es sorgfältig auf. Dann gab er Euch einen Löffel voll zu probieren.;;El polvo rojo tenía un color tentador. Un sirviente cometió el error de probarlo en su forma pura, se le hinchó muchísimo la lengua y [FromFrom.GetTitledFirstName] le reprendió con firmeza por ello. [FromFrom.GetTitledFirstName] vertió la especia en un cáliz de agua y lo removió meticulosamente antes de darte una cucharada.;;;;;;;;;x
MNM.70013.d;My [From.GetJobTitle] has discovered a [found_commander.GetManWoman] of great military talent, called [found_commander.GetFirstName], who is willing to serve in my ranks!;M[From.Get_on_JobTitle] a découvert [found_commander.GetFirstName], un[found_commander.Get_E] [found_commander.GetManWoman] avec un grand talent militaire et qui est prêt[found_commander.Get_E] à servir dans mes rangs !;M[From.Geteineine] [From.GetJobTitle] hat eine[found_commander.GetnMale] [found_commander.GetManWoman] von großem militärischen Talent namens [found_commander.GetFirstName] entdeckt, [found_commander.Getderdie] gewillt ist, in meinen Reihen zu dienen!;;Mi [From.GetJobTitle] ha descubierto a un[found_commander.GetXA] [found_commander.GetManWoman] llamad[found_commander.GetOA] [found_commander.GetFirstName] de gran talento castrense que está dispuest[found_commander.GetOA] a servir en mi ejército.;;;;;;;;;x
NEWBORN_LOG;A §Y$SEX$§! was born to §Y$CHAR1$§! and §Y$CHAR2$§!, named §Y$CHILD$§!.;§Y$CHAR1$§! et §Y$CHAR2$§! ont donné naissance à leur §Y$SEX$§! §Y$CHILD$§!.;§Y$CHAR1$§! und §Y$CHAR2$§! haben [From.Geteineneine] §Y$SEX$§! mit dem Namen §Y$CHILD$§!.;;Un  bebé §Y$SEX$§! ha nacido de §Y$CHAR1$§! y §Y$CHAR2$§!, de nombre §Y$CHILD$§!.;;;;;;;;;x
