#CODE;ENGLISH;FRENCH;GERMAN;;SPANISH;;;;;;;;;x
EVTDESC_HFP_44003;[Root.GetTitledName]\nI write you this letter to inform you that me and my men have officially left your service. We no longer see you fit to rule, and we have once more returned to the faithful service of [From.Religion.GetHighGodName].\n\nSigned,\n[From.GetTitledName];[Root.GetTitledName]\nJe vous écris cette lettre pour vous informer que moi et mes hommes ne sommes officiellement plus à votre service. Nous ne vous voyons plus en état de gouverner et nous sommes revenus une fois de plus au service [From.Get_du_HighGod].\n\nSigné,\n[From.GetTitledName];[Root.GetTitledName]\nIch schreibe Euch diesen Brief, um Euch darüber zu informieren, dass meine Männer und ich offiziell Euren Dienst verlassen haben. Wir sehen Euch nicht länger in der Lage zu herrschen und sind wieder in den treuen Dienst von [From.Religion.GetHighGodName] zurückgekehrt.\n\nGezeichnet,\n[From.GetTitledName];;[Root.GetTitledName]\nEscribo para informarte de que mis hombres y yo hemos abandonado tu servicio. No te vemos dign[Root.GetOA] de gobernar y hemos regresado a servir fielmente a [From.Religion.GetHighGodName]. \n\nFirmado,\n[From.GetTitledName];;;;;;;;;x
monastic_orders_go_celibate;Take Vows of Purity;Faire vœu de pureté;Gelübde der Reinheit ablegen;;;;;;;;;;;x
monastic_orders_go_celibate_desc;Take your relationship with Elune even further and vow to stay pure for 10 years.;llez encore plus loin dans votre relation avec ?lune et faites le v?u de rester pur pendant 10 ans.;Vertieft Eure Beziehung zu Elune noch weiter und schwört, 10 Jahre lang rein zu bleiben.;;;;;;;;;;;x
monastic_orders_stop_celibate;End Celibate;Mettre fin au célibat;Zölibat beenden;;;;;;;;;;;x
monastic_orders_stop_celibate_desc;You have fulfilled your vows and can now end your vow of purity.;Vous avez accompli vos vœux et pouvez mettre fin à votre célibat.;Ihr habt Eure Gelübde erfüllt und könnt Euer Zölibat beenden.;;;;;;;;;;;x
ze_administration_laws_2;Advanced Administration;Administration avancée;Verbesserte Verwaltung;;;;;;;;;;;x
ze_administration_laws_2_desc;A system of management with a hierarchy of judges and officials who work daily for the benefit of the crown. This allows you to have a stronger, centralized state, and reduces the problems you might face from land-based vassals.;Un système de gestion avec une hiérarchie de juges et de fonctionnaires qui travaillent quotidiennement au profit de la couronne. Cela vous permet d'avoir un État plus fort et centralisé, et réduit les problèmes que vous pourriez rencontrer de la part de vos vassaux.;Ein Verwaltungssystem mit einer eigenen Hierarchie von Richtern und Beamten, die täglich für die Krone arbeiten. Dies erlaubt Euch, einen zentralisierteren Staat zu führen und reduziert die Anzahl an Problemen, mit denen Ihr Euch befassen müsst.;;;;;;;;;;;x
ze_administration_laws_2_option;Advanced Administration;Administration avancée;Verbesserte Verwaltung;;;;;;;;;;;x
LOADING_TIP_10;Don't forget to report bugs! Unreported bugs can't be fixed!;N'oubliez pas de signaler les bugs ! Les bugs non signalés ne peuvent pas être corrigés !;Vergesst nicht, Fehler zu melden! Nicht gemeldete Bugs können nicht behoben werden!;;;;;;;;;;;x
LOADING_TIP_12;Lok'tar Ogar!;Lok'tar Ogar !;Lok'tar Ogar!;;;;;;;;;;;x
LOADING_TIP_16;For honour and glory!;Pour l'honneur et la gloire!;Für Ruhm und Ehre!;;;;;;;;;;;x
LOADING_TIP_17;If your children's mentors have levels in any class, they can teach your children the ways of sword and magic.;Si les mentors de vos enfants ont des niveaux dans n'importe quelle classe, ils peuvent enseigner à vos enfants les techniques de l'épée et de la magie.;Wenn die Mentoren Eurer Kinder in irgendeiner Klasse ein bestimmtes Level erreicht haben, können sie Euren Kindern den Umgang mit Schwert und Magie beibringen.;;;;;;;;;;;x
LOADING_TIP_20;Lead the war very carefully, otherwise the whole world could take up arms against you.;Menez la guerre avec beaucoup de prudence, sinon le monde entier pourrait prendre les armes contre vous.;Führt den Krieg sehr vorsichtig, sonst könnte die ganze Welt gegen Euch zu den Waffen greifen.;;;;;;;;;;;x
LOADING_TIP_28;Don't forget to periodically check your possible decisions. There you can find many unique features that will not always be available to you.;N'oubliez pas de vérifier périodiquement vos décisions possibles. Vous y trouverez de nombreuses fonctionnalités uniques qui ne seront pas toujours à votre disposition.;Vergesst nicht, Eure möglichen Entscheidungen regelmäßig zu überprüfen. Dort findet Ihr viele einzigartige Funktionen, die Euch nicht immer zur Verfügung stehen werden.;;;;;;;;;;;x
LOADING_TIP_35;Joining a political faction is a very good way to find new allies for a very long time.;Rejoindre une faction politique est un très bon moyen de trouver de nouveaux alliés pour une très longue période.;Der Beitritt zu einer politischen Fraktion ist eine sehr gute Möglichkeit, für eine sehr lange Zeit neue Verbündete zu finden.;;;;;;;;;;;x
LOADING_TIP_45;Watch out for dark cult activity in your realm. If they get the chance to spread, you may lose your only chance to stop them.;Faites attention aux activités de cultes obscurs dans votre royaume. S'ils ont la possibilité de se propager, vous risquez de perdre votre seule chance de les arrêter.;Achtet auf Aktivitäten dunkler Kulte in Eurem Reich. Wenn sie sich ausbreiten können, könntet Ihr Eure einzige Chance verlieren, sie zu stoppen.;;;;;;;;;;;x
LOADING_TIP_47;If you decide to study the dark arts, you shouldn't forget that you're walking along the edge of the abyss.;Si vous décidez d'étudier les arts sombres, vous ne devez pas oublier que vous marchez au bord de l'abîme.;Wenn Ihr Euch für das Studium der dunklen Künste entscheidet, solltet Ihr nicht vergessen, dass Ihr am Rande des Abgrunds wandelt.;;;;;;;;;;;x
LOADING_TIP_53;If your class level is low, you can ask other characters with a higher level in the same class to mentor you personally by right-clicking their portraits.;Si votre niveau de classe est faible, vous pouvez demander à d'autres personnages de niveau supérieur dans la même classe de vous encadrer personnellement en cliquant sur leur portrait avec le bouton droit de la souris.;Wenn Eure Klassenstufe niedrig ist, könnt Ihr andere Charaktere mit einer höheren Stufe in der gleichen Klasse bitten, Euch persönlich zu unterrichten, indem Ihr auf deren Portraits rechtsklickt.;;;;;;;;;;;x
LOADING_TIP_54;The dark gods can be very eloquent and convincing, but you are just a pawn in their grand game.;Les dieux obscurs peuvent être très éloquents et convaincants, mais vous n'êtes qu'un pion dans leur grand jeu.;Die dunklen Götter können sehr eloquent und überzeugend sein, Ihr aber seid nichts als eine Schachfigur in ihrem großen Spiel.;;;;;;;;;;;x
lance_tier_4_impaler;Runespear;Lance runique;Runenspeer;;;;;;;;;;;x
lance_tier_4_impaler_desc;A well created mockery of the legendary spear of the Bloodhoof clan.;Une réplique bien conçue de la légendaire lance du clan Sabot-de-Sang.;Eine gut angefertigte Nachahmung des legendären Speers des Bloodhoof-Clans.;;;;;;;;;;;x
DIPLOFLAVOR_INSULT_0;Tales of your misdeeds are told from Winterspring to Stranglethorn.;Vos méfaits sont connus du Berceau-de-l'Hiver à Strangleronce.;Geschichten über deine Missetaten werden von Winterspring bis Stranglethorn erzählt.;;;;;;;;;;;x
DIPLOFLAVOR_INSULT_1;Your low character is the subject of Tortollan stories.;Votre bassesse a inspiré des légendes tortolannes.;Euer niederer Charakter ist Gegenstand von tortollanischen Geschichten.;;;;;;;;;;;x
EVTDESC6304;Your slightly eccentric liege has proclaimed a new law that is to be upheld throughout the realm. It reads:\n\n"Whereas the children of the realm have become desensitised to violence, and: whereas the general populace seems to have lost all regard for the sanctity of life:\n\nTherefore I, [From.GetTitledName], decree that all forms of violence directed at other reasonable beings be outlawed, including both capital and corporal punishment as well as the torture of criminals, heathens and foreigners. These vulnerable social groups are instead to be rehabilitated and eventually released back into society as productive citizens.;Votre suzerain un peu excentrique a proclamé une nouvelle loi qui doit être respectée dans tout le royaume. Elle se lit comme ceci :\n\n« Attendu que les enfants du royaume se sont désensibilisés à la violence et que la population semble avoir perdu toute considération pour le caractère sacré de la vie :\n\nC'est pourquoi moi, [From.GetTitledName], décrète que  toutes les formes de violence dirigées contre d'autres êtres raisonnables sont interdites, y compris la peine capitale et les châtiments corporels ainsi que la torture des criminels, des païens et des étrangers. Ces groupes sociaux vulnérables doivent au contraire être réhabilités et finalement réintégrés dans la société en tant que citoyens productifs. »;Euer leicht exzentrischer Lehnsherr hat ein neues Gesetz verkündet, das im ganzen Reich eingehalten werden soll. Es lautet: \n\n „Während die Kinder des Reiches gegenüber Gewalt desensibilisiert worden sind, und: während die allgemeine Bevölkerung anscheinend alle Achtung vor der Heiligkeit des Lebens verloren hat: \n\nDaher verfüge Ich,[From.GetTitledName], dass alle Formen von Gewalt, die gegen andere vernunftbegabte Wesen gerichtet sind, verboten werden, einschließlich der Todes- und Körperstrafe sowie der Folter von Verbrechern, Heiden und Ausländern. Diese verwundbaren sozialen Gruppen sollen stattdessen rehabilitiert und schließlich als produktive Bürger wieder in die Gesellschaft entlassen werden.“;;;;;;;;;;;x
EVTDESC6308;The new law has been written and couriers are even now distributing it to all of your vassals. You admire your handiwork:\n\n"Whereas the children of the realm have become desensitised to violence, and: whereas the general populace seems to have lost all regard for the sanctity of life:\n\nTherefore I, [From.GetTitledName], decree that all forms of violence directed at other reasonable beings be outlawed, including both capital and corporal punishment as well as the torture of criminals, heathens and foreigners. These vulnerable social groups are instead to be rehabilitated and eventually released back into society as productive citizens.;La nouvelle loi a été rédigée et des coursiers la distribuent en ce moment même à tous vos vassaux. Vous admirez votre travail : « Attendu que les enfants du royaume se sont désensibilisés à la violence, et que la population semble avoir perdu toute considération pour le caractère sacré de la vie".\n\nC'est pourquoi moi, [From.GetTitledName], décrète que toutes les formes de violence dirigées contre d'autres êtres raisonnables sont interdites, y compris la peine capitale et les châtiments corporels ainsi que la torture des criminels, des païens et des étrangers. Ces groupes sociaux vulnérables doivent au contraire être réhabilités et finalement réintégrés dans la société en tant que citoyens productifs. »;Das neue Gesetz wurde erlassen und die Kuriere verteilen es bereits an alle Eure Vasallen. Ihr bewundert Euer Werk:\n\n „Während die Kinder des Reiches gegenüber Gewalt desensibilisiert worden sind, und: in der Erwägung, dass die allgemeine Bevölkerung anscheinend alle Achtung vor der Heiligkeit des Lebens verloren hat:\n\n\ Deshalb erlasse ich, [From.GetTitledName], dass alle Formen von Gewalt, die sich gegen andere vernunftbegabte Wesen richten, verboten werden, einschließlich der Todes- und Körperstrafe sowie der Folter von Kriminellen, Heiden und Ausländern. Diese verwundbaren sozialen Gruppen sollen stattdessen rehabilitiert und schließlich als produktive Bürger wieder in die Gesellschaft entlassen werden.“;;;;;;;;;;;x
employ_priestess;Invite [Root.GetRelAdjective] Woman to Court;Inviter une femme [Root.GetRelAdjective] à la Cour;Ladet eine [Root.GetRelAdjective]e Frau an den Hof ;;;;;;;;;;;x
employ_priestess_desc;Scour the land for a [Root.GetRelAdjective] Woman to join my court and advise me on religious matters.;Parcourez le pays à la recherche d'une femme [Root.GetRelAdjective] pour rejoindre ma cour et me conseiller sur les questions religieuses.;Durchkämmt das Land nach einer [Root.GetRelAdjective]en Frau, die sich Eurem Hof anschließt und Euch in religiösen Fragen berät.;;;;;;;;;;;x
employ_priest;Invite [Root.GetRelAdjective] Man to Court;Inviter un homme [Root.GetRelAdjective] à la Cour;Ladet einen [Root.GetRelAdjective]en Mann an den Hof;;;;;;;;;;;x
employ_priest_desc;Scour the land for a [Root.GetRelAdjective] Man to join my court and advise me on religious matters.;Parcourez le pays à la recherche d'un homme [Root.GetRelAdjective] pour rejoindre ma cour et me conseiller sur les questions religieuses.;Durchkämmt das Land nach einem [Root.GetRelAdjective]en Mann, der sich Eurem Hof anschließt und Euch in religiösen Fragen berät.;;;;;;;;;;;x
pagan_county_conquest_desc;Conquer border territory of an aggressive neighbour... or of just a neighbour if you're aggressive enough. Pirates, murlocs, naga, vrykul and evil religions can also take any coastal county.;Conquérez le territoire frontalier d'un voisin agressif... ou d'un simple voisin si vous êtes assez agressif. Les pirates, les murlocs, les Nagas, les Vrykuls et les religions maléfiques peuvent également s'emparer de n'importe quel comté côtier.;Erobert das Grenzgebiet eines aggressiven Nachbarn... Oder nur eines Nachbarn, wenn Ihr aggressiv genug seid. Piraten, Murlocs, Naga, Vrykul und böse Religionen können auch jedes Küstengebiet einnehmen.;;;;;;;;;;;x
title_master_of_the_horse_desc;The Master of the Horse delegates the actual day to day running of the actual stables, much of the prestige of this office comes from the responsibility for the stud.;Le Maître des chevaux reçoit la gestion quotidienne des écuries. Une grande partie du prestige de cette fonction vient de la responsabilité de l'étalon.;Der Stallmeister delegiert den täglichen Betrieb der eigentlichen Ställe, ein Großteil des Prestiges dieses Amtes stammt aus der Verantwortung für das Gestüt.;;;;;;;;;;;x
OFFMAP_GRACE_TOOLTIP;This is your current §Y[Root.GetCurrency]§!;Voici votre §Y[Root.GetCurrency]§!;Dies ist Eure aktuelle §Y[Root.GetCurrency]§!;;Esta es tu §Y[Root.GetCurrency]§!;;;;;;;;;x
OFFMAP_VIEW_BUTTON_INSTANT;$OFFMAP|Y$\nOpen interaction with §Y$OFFMAP_SHORT$§!.;$OFFMAP|Y$\nOuvrir l'écran d'interaction avec la §Y$OFFMAP_SHORT$§!.;$OFFMAP|Y$\nÖffnet die Interaktion mit §Y$OFFMAP_SHORT$§!.;;$OFFMAP|Y$\n¡Interacción abierta con §Y$OFFMAP_SHORT$ China§!.;;;;;;;;;x
human_anatomy;Humanoid Anatomy;Anatomie humanoïde;Menschliche Anatomie;;;;;;;;;;;x
syphilitic;Has Devouring Plague;A la peste dévorante;Hat die verschlingende Seuche;;;;;;;;;;;x
syphilitic_desc;This character suffers from Devouring Plague, a type of venereal disease.;Ce personnage a la peste dévorante, un type de maladie vénérienne.;Dieser Charakter leidet an der verschlingenden Seuche, einer Art von Geschlechtskrankheit.;;;;;;;;;;;x
syphilitic_death;of Devouring Plague;de la peste dévorante;der verschlingenden Seuche;;;;;;;;;;;x
String_syphilis;Devouring Plague;Peste dévorante;Verschlingende Seuche;;;;;;;;;;;x
EVTDSC_RIP_5061;For some time now, my [GetFromRelation] [From.GetTitledFirstName] has been avoiding me. [From.GetSheHeCap] has not visited my bedchamber for several weeks. When I have demanded to know why [From.GetSheHe] has given me nothing but feeble excuses. Today I overheard a couple of [From.GetHerHis] servants gossiping. They said [From.GetFirstName] has contracted Devouring Plague!;Depuis quelque temps, [From.GetTitledFirstName] m'évite. Cela fait plusieurs semaines qu'[From.GetIlElle] n'est pas venu dans ma chambre à coucher. Quand j'ai demandé à savoir pourquoi, [From.GetIlElle] ne m'a donné que de faibles excuses. Aujourd'hui, j'ai entendu deux de ses serviteurs bavarder : ils ont dit que [From.GetFirstName] avait contracté la peste dévorante !;Seit einiger Zeit geht mir Mein[From.GeteFemale] [GetFromRelation] [From.GetTitledFirstName] aus dem Weg. [From.GetSheHeCap] hat mein Schlafgemach seit mehreren Wochen nicht mehr aufgesucht. Wenn ich nach dem Grund gefragt habe, hat [From.GetSheHe] mir nichts als schwache Ausreden geliefert hat. Heute hörte ich ein paar [From.GetHerHis]er Diener tratschen. Sie sagten, dass sich [From.GetFirstName] mit der verschlingenden Seuche angesteckt hat!;;;;;;;;;;;x
EVTDESCRIP.5027;Repulsive sores and abscesses are spreading across your body. You have contracted Devouring Plague.;Des plaies et des abcès répulsifs se répandent sur votre corps. Vous avez contracté la peste dévorante.;Abstoßende Wunden und Abszesse breiten sich über Euren Körper aus. Ihr habt Euch mit der verschlingenden Seuche infiziert.;;;;;;;;;;;x
syphilis;Devouring Plague;Peste dévorante;Verschlingende Seuche;;;;;;;;;;;x
EVTDESC_RIP_11022;The sores on your body have vanished and you are almost back to your regular self. You are rid of Devouring Plague.;Les plaies sur votre corps ont disparu et vous êtes presque revenu à votre état normal. Vous êtes débarrassé de la peste dévorante.;Die Wunden an Eurem Körper sind verschwunden, und Ihr seid fast wieder zu Eurem normalen Selbst zurückgekehrt. Ihr seid die verschlingende Seuche los.;;;;;;;;;;;x
tooltip_feudal_elector_vote_syphilitic;[From.GetSheHeCap] has been struck by §YDevouring Plague§!;[From.GetSheHeCap] a été frappé par la §Ypeste dévorante§!.;[From.GetSheHeCap] wurde von der §Yverschlingenden Seuche§! heimgesucht.;;;;;;;;;;;x
has_typhoid_fever;Has Frost Fever;A la fièvre de givre;Hat Frostfieber;;;;;;;;;;;x
has_typhoid_fever_desc;This character suffers from Frost Fever, a disease that lowers the body's temperature.;Ce personnage est atteint d'un terrible mal appelé fièvre de givre, un mal qui baisse la température du corps.;Dieser Charakter leidet am Frostfieber, einer Krankheit, die die Körpertemperatur senkt.;;;;;;;;;;;x
has_typhoid_fever_death;of Frost Fever;de la fièvre de givre;des Frostfiebers;;;;;;;;;;;x
String_slow_fever;Frost Fever;Fièvre de givre;Frostfieber;;;;;;;;;;;x
EVTDESCRIP.5029;You feel as if you are burning up, yet your body shivers as if you are freezing. You have contracted Frost Fever.;Vous avez l'impression de vous brûler, mais votre corps frissonne comme si vous étiez gelé. Vous avez contracté la fièvre de givre.;Ihr fühlt Euch, als würdet Ihr verbrennen, doch Euer Körper zittert, als würdet Ihr frieren. Ihr habt Euch mit Frostfieber angesteckt.;;;;;;;;;;;x
typhoid_fever;Frost Fever;Fièvre de givre;Frostfieber;;;;;;;;;;;x
EVTDESC_RIP_11025;Your delirium has lifted and your temperature is back to normal. You have beaten Frost Fever.;Votre délire s'est dissipé et votre température revenue à la normale. Vous avez vaincu la fièvre de givre.;Euer Delirium hat sich gebessert und Eure Temperatur ist wieder normal. Ihr habt das Frostfieber besiegt.;;;;;;;;;;;x
tooltip_feudal_elector_vote_has_typhoid_fever;[From.GetSheHeCap] is being consumed by §YFrost Fever§!;[From.GetSheHeCap] est rongé par la §Yfièvre de givre§!;[From.GetSheHeCap] wird vom §YFrostfieber§! verzehrt.;;;;;;;;;;;x
TYPHOID_FEVER_INFO;Frost Fever is loose in this county.;La fièvre de givre circule dans ce comté.;Frostfieber wütet in dieser Provinz.;;;;;;;;;;;x
has_tuberculosis;Has Blood Plague;Peste de sang;Hat die Blutpest;;;;;;;;;;;x
has_tuberculosis_desc;This character suffers from Blood Plague. This disease affects the organs and causes internal bleeding.;Ce personnage est atteint d'un terrible mal appelé peste de sang. Cette maladie affecte les organes et cause des saignements internes.;Dieser Charakter leidet an der Blutpest. Diese Krankheit befällt die Organe und verursacht innere Blutungen.;;;;;;;;;;;x
has_tuberculosis_death;of Blood Plague;de la peste de sang;der Blutpest;;;;;;;;;;;x
String_consumption;Blood Plague;Peste de sang;Blutpest;;;;;;;;;;;x
tuberculosis;Blood Plague;Peste de sang;Blutpest;;;;;;;;;;;x
TUBERCULOSIS_INFO;Blood Plague is loose in this county.;La peste de sang circule dans ce comté.;Die Blutpest ist in dieser Provinz weit verbreitet.;;;;;;;;;;;x
EVTDESCRIP.5028;You are thrown between waves of chills and sweats. Food has lost its appeal and no amount of sleep seems to remedy your fatigue. You have contracted Blood Plague.;Vous êtes ballotté entre des vagues de frissons et de sueurs. La nourriture a perdu de son attrait et aucune quantité de sommeil ne semble remédier à votre fatigue. Vous avez contracté la peste de sang.;Ihr werdet von Wellen von Schüttelfrost und Schweißausbrüchen heimgesucht. Das Essen hat seinen Reiz verloren, und kein Schlaf scheint Eure Müdigkeit zu lindern. Ihr habt Euch mit der Blutpest angesteckt.;;;;;;;;;;;x
EVTDESC_RIP_11024;You awake rejuvenated. After some moments of disbelief you realise that your fever has passed and your appetite has returned. You have survived the Blood Plague.;Vous vous réveillez rajeuni. Après quelques moments d'incrédulité, vous vous rendez compte que votre fièvre est passée et que votre appétit est revenu. Vous avez survécu à la peste de sang.;Ihr wacht erneuert und verjüngt auf. Nach einigen Momenten des Unglaubens stellt Ihr fest, dass das Fieber vorbei ist und der Appetit wiederkehrt. Ihr habt die Blutpest überlebt.;;;;;;;;;;;x
tooltip_feudal_elector_vote_has_tuberculosis;[From.GetSheHeCap] has been struck by §YBlood Plague§!;[From.GetSheHeCap] a été frappé par la §Ypeste de sang§!;[From.GetSheHeCap] wurde von der §YBlutpest§ heimgesucht.;;;;;;;;;;;x
has_typhus;Has Swamp Fever;A la fièvre des marais;Hat Sumpffieber;;;;;;;;;;;x
has_typhus_desc;This character suffers from Swamp Fever.;Ce personnage est atteint d'un terrible mal appelé fièvre des marais.;Dieser Charakter leidet an Sumpffieber.;;;;;;;;;;;x
has_typhus_death;of Swamp Fever;de la fièvre des marais;des Sumpffiebers;;;;;;;;;;;x
String_camp_fever;Swamp Fever;Fièvre des marais;Sumpffieber;;;;;;;;;;;x
typhus;Swamp Fever;Fièvre des marais;Sumpffieber;;;;;;;;;;;x
TYPHUS_INFO;Swamp Fever is loose in this county.;La fièvre des marais circule dans ce comté.;Das Sumpffieber ist in dieser Provinz weit verbreitet.;;;;;;;;;;;x
EVTDESCRIP.5040;Your mind is clouded and a dull red rash is spreading across your body. You feel hot and your joints ache. You have contracted Swamp Fever.;Votre esprit est troublé et une éruption cutanée rouge et terne se répand sur votre corps. Vous avez chaud et vos articulations vous font mal. Vous avez contracté la fièvre des marais.;Euer Geist ist getrübt und ein dumpfer roter Ausschlag breitet sich über Euren Körper aus. Ihr fühlt Euch heiß und Eure Gelenke schmerzen. Ihr habt Euch mit Sumpffieber angesteckt.;;;;;;;;;;;x
EVTDESC_RIP_11026;A vigor has returned to you as the aches from your recent disease leaves your body. You have survived Swamp Fever.;Une vigueur vous est revenue alors que les douleurs de votre récente maladie quittent votre corps. Vous avez survécu à la fièvre des marais.;Eure Kraft ist zu Euch zurückgekehrt, als die Schmerzen Eurer jüngsten Krankheit Euren Körper verlassen haben. Ihr habt das Sumpffieber überlebt.;;;;;;;;;;;x
tooltip_feudal_elector_vote_has_typhus;[From.GetSheHeCap] is being consumed by §YSwamp Fever§!;[From.GetSheHeCap] est dévoré par la §Yfièvre des marais§!;[From.GetSheHeCap] wird von §YSumpffieber§! verzehrt.;;;;;;;;;;;x
succession_voting_power_1_effect_tooltip;§YPowerful Vassals§! cannot be fired from the §YCouncil§!\nCan no longer change succession if §YElective Monarchy§! is instituted;Les §Yvassaux puissants§! ne peuvent pas être révoqués du §YConseil§!\nLa loi de succession ne peut plus être changée si la §Ymonarchie élective§! est instaurée;§YMächtige Vasallen§! können nicht vom §YRat§! ausgeschlossen werden.\nDie Nachfolge kann nicht geändert werden, wenn §YWahlmonarchie§! etabliert ist.;;§YVasallo poderoso§! no puede ser despedido del §YConsejo§!\nNo se puede volver a cambiar la sucesión si se instituye §YMonarquia Electiva§!.;;;;;;;;;x
succession_voting_power_0_effect_tooltip;§YPowerful Vassals§! can be fired from the §YCouncil§!\nCan now change succession if §YElective Monarchy§! is instituted;Les §Yvassaux puissants§! peuvent être révoqués du §YConseil§!\nLa loi de succession peut désormais être changée si la §Ymonarchie élective§! est instaurée;§YMächtige Vasallen§! können vom §YRat§! ausgeschlossen werden.\nDie Nachfolge kann geändert werden, wenn §YWahlmonarchie§! etabliert ist.;;§YVasallos poderosos§! puede ser despedido del §YConsejo§!\nAhora puede cambiar la sucesión si se instituye §YMonarquía Electiva§!.;;;;;;;;;x
